pregunta;respuesta
¿Quién llama a la puerta?;Who's knocking at / on the door?
Estate quieto.;Be still.
¿Qué significa esto?;What does this mean?
Tenemos que calcular la cantidad.;We have to calculate the amount.
Déjalo aquí para que otra gente lo pueda usar;Leave it here so that other people can use it, too.
también.;
Esa es una idea fabulosa.;That's a terrific idea.
No se me ocurrió.;It didn't occur to me.
¿Por qué no se te ocurrió?;Why didn't it occur to you?
Cosas así nunca se me ocurren.;Thinks like that never occur to me.
Tendrás que tomar una decisión.;You'll have to make a decision.
¿No puedes esperar un poco más?;Can't you wait a little longer?
Nunca le gustaba comer fuera.;He never liked to eat out.
¿Qué propones que hagamos?;What do you propose we do?
¿Cuánto tiempo nos queda?;How much time do we have left?
Nos quedan dos horas.;We have two hours left.
Hay un agujero en tu camisa.;There's a hole in your shirt.
Dividamos el dinero.;Let's divide the money.
Lo quiero todo para mí.;I want it all for me.
No me gusta tratar con gente como tú.;I don't like to deal with people like you.
Puedes hacer lo que quieras.;You can do whatever you want.
Funcionará si lo tratas bien.;It'll work if you treat it well.
No sabes hacer nada.;You don't know how to do anything.
¿Funciona?;Does it work?
Me alegro de saber eso.;I'm glad to know that.
No hay razón para estar preocupado.;There's no reason to be worried.
Deben de tener miedo de volar.;They must be afraid of flying.
Él bebe demasiado.;He drinks too much.
Puedo oír todo lo que hacen.;I can hear everything they do.
No les escuches.;Don't listen to them.
No lo puedo evitar.;I can't help it.
Debe de ser terrible.;It must be terrible.
Creo que ella le envidia a él.;I think she envies him.
No vuelvas a pegarme nunca.;Don't ever hit me again.
¿Sigues pegando a tu mujer?;Are you still hitting your wife?
¿Cuál fue la decisión final?;What was the final decision?
¿Por qué no estuviste allí?;Why weren't you there?
Les dije que ibas a estar allí.;I told them you were going to be there.
Van a pensar que soy un mentiroso.;They're going to think I'm a liar.
Pareces una rata mojada.;You look like a wet rat.
Descansa un rato, pareces cansado.;Rest for a while, you look tired.
Tómalo o déjalo.;Take it or leave it.
Saltaron el muro.;They jumped over the wall.
¿Quién les dio permiso para hacer semejantecosa?;Who gave them permission to do such a thing?
Mi búsqueda terminó en fracaso.;My search ended in failure.
¿Por qué fracasaste?;Why did you fail?
Algún dia tendré éxito.;Someday I'll succeed.
El éxito no es lo más importante.;Success isn't the most important thing.
Él es un hombre de éxito.;He's a successful man.
Soy un fracasado.;I'm a failure.
¿Sientes pena de ti mismo?;Do you feel sorry for yourself?
El partido fue muy emocionante.;The game / match was very exciting.
¿Quién ganó?;Who won?
Empataron.;They tied.
Fue un empate.;It was a tie / draw.
¿Quién marcó los goles?;Who scored the goals?
¿Cuál fue el resultado final?;What was the final score?
Llevé a mi hijo a verlo;I took my son to see it.
Es un poco joven, ¿no?;He's a little young, isn't he?
Por lo visto, no.;Apparently not.
Parecía disfrutar con el partido.;He seemed to enjoy the game.
¿A qué hora legasteis a casa?;What time did you get back home?
Mucho más tarde de lo que esperaba.;Much later than I excepted.
¿Qué dirán cuando se enteren?;What will they say when they find out?
Fue un completo fracaso;It was a complete failure
¿De quién fue la culpa?;Whose fault was it?
No fue culpa de nadie;It wasn't anybody's fault
Habrá una investigación;There will be an investigation
No encontrarás nada;You won't find anything
Ya veremos;We'll see
¿Que planes tienes para el domingo?;What plans do you have for Sunday?
Vamos a ver a unos amigos;We're going to see some friends
¿Les conozco?;Do I know them?
Creo que no;I don't think so
¿Qué tal tu trabajo?;How's your job?
Todo va bien;Everything's going fine
Todo va de maravilla;Everything's going great
Me alegro de oir eso;I'm glad to hear that
Entonces no piensan despedirte;Then they don't plan to fire you
Espero que no;I hope not
No me gusta estar cerca de el;I don't like to be near him
¿Huele mal?;Does he smell bad?
No seas gracioso;Don't be funny
No pretendo ser gracioso;I'm not trying to be funny
Tengo algo importante que decirte;I have something important to tell you
Adelante;Go ahead
Voy a decirte algo que no te va a gustar;I'm going to tell you something you're not going to like
Deja que yo decida eso;Let me decide that
Si eso es lo que quieres;If that's what you want
Tu sabes muy bien lo que quiero;You know very well what I want
No tengo ni idea;I have no idea
Quiero casarme con tu hija;I want to marry your daugther
¿Quieres que?;You want what?
Ya me oiste;You heard me
Pero ella es mucho mas joven que tu;But she's much younger than you are
¿Me estas llamando viejo?;Are you calling me an old man?
¿La quieres de verdad?;Do you really love her?
La quiero y ella me quiere a mi;I love her and she loves me
Queremos casarnos la proxima semana;We want to get married next week
¿Cuando empezasteis a salir juntos?;When did you start going out together?
Hace un par de meses;A couple of months ago
¿Donde conociste a mi hija?;Where did you meet my daughter?
¿Sabe mi mujer algo de esto?;Does my wife know anything about this?
¿Quien se lo dijo?;Who told her?
Espero que sepas lo que haces;I hope you know what you're doing
¡Que desagradable sorpresa!;What an unpleasant surprise!
No esperes tener mi consentimiento;Don't expect to have my consent
¿Por qué no me dijo nada ella?;Why didn't she tell me anything?
Espero que no este esperando un niño;I hope she's not expecting a baby
¿Que sugieres que hagamos?;What do you suggest we do?
Toma tus propias decisiones;Make your own decisions
¿No me vas a dar consejos?;Aren't you going to give any advice?
¿Para que?;What for?
Al menos felicitanos;At least congratule us
Dile que venga;Tell him to come
Me gustaria probarlo;I'd like to try it
Diles que tengan cuidado;Tell them to be careful
Quiero ir con el;I want to go with him
Quiero que vayas con el;I want you to go with him
No le digas quien soy;Don't tell him who I am
No quiero que el sepa nada;I don't want him to know anything
Me dijeron que le buscara;They told me to look for him
Nadie te dijo que hicieras nada;Nobody told you to do anything
Te dije que volvieras a hacerlo;I told you to do it again
¿Por que no volviste a hacerlo?;Why didn't you it again?
¿Quien te dijo que me llamaras?;Who told you to call me?
Quiero que me mires;I want you to look at me
Quiero que sepas una cosa;I want you to know something
Quiero que compartas tus juguetes;I want you to share your toys
Quiero que seas el juez;I want you to be the judge
Quiero que seas justo;I want you to be fair
Dile que se vaya;Tell him to leave
Vigilales;Watch them
Quieren que perdamos;They want us to loose
Queremos que ganeis;We want you to win
Quiero que os lo paseis bien;I want you to have a good time
Quiero que lo pienses;I want you to think about it
No quieren que vengamos;They don't want us to come
Quiero que encuentres una solucion;I want you to find a solution
No va a ser facil;It's not going to be easy
Quiero que tengas esto;I want you to have this
Es fácil dar ordenes;It's easy to give orders
Es dificil llevarlas a cabo;It's difficult to carry them out
No te pedi que hicieras nada;I didn't ask you to do anything
Te estoy pidiendo que seas mi amigo;I'm asking you to be my friend
Diles que no me miren;Tell them not to look at me
Pideles que no fumes;Ask them not to smoke
¿Por que quieres que yo haga eso?;Why do you want me to do that?
¿Que quieres que yo haga?;What do you want me to do?
¿Que quieres que diga?;What do you want me to say?.
¿A donde quieres que yo vaya?;Where do you want me to go?
¿Cuando quieres que yo esté aquí?;When do you want me to be here?
¿Con quién quieres que hable?;Who do you want me to speak to?
¿Con que frecuencia quieres que le llame?;How often do you want me to call him?
¿Cual quieres que elija?;Which one do you want me to choose?
¿Cuanto tiempo queres que dure la reunion?;How long do you want the meetimg to last?
¿Como quieres que la convenza?;How do you want me to convince her?
¿Como quieres que te llame?;How do you want me to call you?
¿A donde quieres que te lleve?;Where do you want me to take you?
Casi nunca como pan;I hardly ever eat bread
Siempre uso ceniceros;I always use ashtrays
Raramente viajamos;We seldom travel
Nunca estan satisfechos;They're never satisfied
Divertios;Have a good time
¿Te gustaria juntarte con nosotros?;Would you like to join us?
¿Que clase de persona es el?;What kind of person is he?
Agradezco tu interes;I appreciate your interest
Hagamos algo;Let's do something
¿Nos vamos?;Shall we go?
Vamonos;Let's go
¿Les ayudo?;Shall I help them?
Esta es tu ultima oportunidad;This is your last chance
Puedes ir a donde quieras;You can go wherever you want
Puedes hacer lo que quieras;You can do whatever you want
Puedes llamar a quien quieras;You can call whoever you want
Te puedes ir cuando quieras;You can leave whenever you want
¿Cuando les recogeras?;When will you pick them up?
¿Estarán esperándote?;Will they be waiting for you?
¿Por que no llevas mi coche?;Why don't you take my car?
Intentemos ser amigos;Let's try to be friends
Me gustaría regalarte este libro;I'd like to give you this book
Eso es muy amable por tu parte;That's very kind of you
No dejes que te molesten;Don't let them bother you
¿Te estoy molestando?;Am I bothering you?
Enseguida vuelvo, no te vayas;I'll be right back, don't go away
¿Que podemos hacer?;What can we do?
Olvidate de ella;Forget about her
Me encanta escucharte hablar;I love listening to you talk
Me encantaría estar contigo;I'd love to be with you
¿Te quieres venir con nosotros?;Do you want to come with us?
Si, me enacantaría;Yes, I'd love to
Entonces, ¿a que estamos esperando?;Then, what are we waiting for?
Esto no tiene nada que ver con aquello;This has nothing to do with that
¿Qué hacemos?;What shall we do?
Las cosas mejoraran;Things will get better
Era un discurso tan aburrido que me dormé;It was such a boring speech that I felt asleep
No fuí el único;I wasn't the only one
Dejame que te ayude;Let me help you
Me alegro de que ganaras;I'm glad you won
Siento que perdieras;I'm sorry you lost
Veamos lo que tienes;Let's see what you have
Pideles que caminen mas despacio;Ask them to walk more slowly
Me temo que vaya a llover;I'm afraid it's going to rain
Dile lo que quieras;Tell him whatever you want
¿Por que quiere él que hagas eso?;Why does he want you to do that?
Me enteré de ello ayer;I learned about it yesterday
No me despiertes demasiado temprano;Don't wake me up too early
¿Enciendo la luz ahora?;Shall I turn on the light now?
Dile que se quede donde esta;Tell him to stay where he his
Dile que no se mueva;Tell him not to move
El mío es mucho mejor que el tuyo;Mine is much better than yours
Estoy buscando a alguien que sepa hablar;I'm looking for someone who knows how to speak English
ingles;
Nací en un país de habla inglesa;I was borne in an English-speaking country
¿Es el ingles tu lengua materna?;Is English your mother tongue?
¿Cuando tomarás una decisión?;When will you make a decision?
Cuando deje de llover;When it stop raining
El dejó la escuela a los años;He quit school at the age of
Tengo que dejar de fumar;I have to quit smoking
¡Dejame en paz!;Leave me alone!
¿Tienes algo que decir?;Do you have anything to say?
Poca gente es tan impaciente como tu;Few people are as impatient as you are
¿Cuando estarán de vuelta?;When will they be back?
¿Que hago mientras tanto?;What shall I do in the meantime?
Nunca leo libros gruesos;I never read thick books
Siempre utilizo papel fino;I always use thin paper
Estás engordando;You're getting fat
Estoy intentando adelgazar;I'm trying to loose weight
¿Cuanto pesas?;How much do you weigh?
No tanto como tu;Not as much as you do
¡Que pelicula mas emocionante!;What an exciting movie!
Es una chica muy sensata;She is a very sensible girl
Es una chica muy sensible;She's a very sensitive girl
Sé sensato;Be sensible
¿Quién sacó la foto?;Who took the picture?
Las cosas están empeorando;Things are getting worse
Él es la peor persona para el trabajo;He's the worst person for the job
Te dije que no tocaras nada;I told you not to touch anything
¿Por qué no me obedeciste?;Why didn't you obey me?
Siempre me fiaba de él;I always trusted him
Nos trajeron aquí para trabajar;They brought us here to work
No me dí cuenta de que estabas aquí;I didn't realise you were here
Ni siquiera John sabía qué hacer;Not even John knew what to do
Elige el que quieras;Choose / pick whichever one you want
Él pesa más que yo;He weighs more than I do
Esta es la ciudad mas sucia del mundo;This is the dirtiest city in the world
No hay tanto petroleo aquí como en ArabiaSaudita;There isn't as much oil here as in Saudi Arabia
No te comportes como él;Don't behave like him
No te des por vencido;Don't give up
¿No tuviste una oportunidad?;Didn't you have a chance?
No les hagas caso;Don't pay any attention to them
Manten los ojos abiertos;Keep your eyes open
No puedo alcanzarlo;I can't reach it
Él no debe estar en casa;He must not be at home
¿Como lo sabes?;How do you know?
No coge el teléfono;He doesn't answer the telephone
Sigue intentando;Keep trying
Es una pérdida de tiempo;It's a waste of time
Tengo que ponerme en contacto con el;I have to contact him
Nunca le encontarás;You'll never find him
Querer es poder;Where there's a will, there's a way
No necesitamos tus proverbios;We don't need your proverbs
¿Quién te enseñó a hablar así?;Who taught you to speak like that?
Mi madre me enseñó todo lo que sé;My mother taught me everything I know
Eres un hombre afortunado;You're a lucky man
¿Cuando habrá un examen?;When will there be an exam?
Te llamaremos en cuanto lo recibamos;We'll call you as soon as we receive it?
¿Cuando creeis que lo recibireis?;When do you think you'll receive it?
Quiesiera discutir estos asuntos contigo;I'd like to discuss these matters with you
Quiero pedirte perdo;I want to apologise to you n
No te preocupes, no fue nada;Don't worry, it was nothing
Espero que no estés enfadado;I hope you're not angry
¿Como quieren ellos que lo resolvamos?;How do they want us to solve it?
Me vestí despues del desayuno;I got dressed after breakfast
¿Cuanto tardas en vestirte?;How long does it take you to get dressed?
Los ladrones se llevaron todo;The thieves took everything
¡Que lastima!;What a pity!
El seguro lo pagará;The insurance will pay for it
No menciones mi nombre;Don't mention my name
No le digas que te lo dije;Don't tell him I told you
Él no lo creera cuando lo oiga;He wont believe it when it hears it
No dejes que eso te preocupe;Don't let that worry you
La operación comenzará esta noche;The operation will begin tonight
Su exito dependera de tí;It's success will depend on you
No me asustes;Don't scare me
¿Que clase de comportamiento es ese?;What kind of behaviour is that?
Te quemarás el brazo;You'll burn your arm
¿Realmente quieres este trabajo?;Do you really want this job?
Entonces lo tendrás que ganar;Then you'll have to earn it
Significará mucho mas dinero;It'll mean a lot more money
Pero esperarán mucho de ti;But they'll expect a lot from you
Tendrás que llegar aquí mas temprano;You'll have to get here earlier
Tendrás que demostrar to valía;You'll have to prove your worth
Tendrás que tomar decisiones;You'll have to make decisions
Tendrás que tratar con gente;You'll have to deal with people
Tendrás que ser duro a veces;You'll have to be hard at times
¿Todavía quieres el trabajo?;Do you still want the job?
Por supuesto que sí;Of course I do
Entonces es tuyo, disfruta con él;Then it's yours, enjoy it
No sé como agradecertelo;I don't know how to thank you
No tienes que agradecermelo;You don't have to thank me
¿Cuando empiezo?;When do I start?
¿Donde estará mi despacho?;Where will my office be?
¿Cuantas personas dependerán de mí?;How many people will report to me?
¿De quién dependeré?;Who will I report to?
¿Como es él?;What's he like?
¿Que clase de persona es?;What kind of person is he?
¿Crees que nos llevaremos bien?;Do you think we'll get along?
¿Es un jefe duro?;Is he a though boos?
¿Cuanto tiempo trabajaste con el?;How long did you work with him?
¿Por qué te marchaste de la compañía?;Why did you leave the company?
¿Quién era el jefe en aquel entonces?;Who was the boos at that time?
¿Intento él hacer que volvieras?;Did he try to make you come back?
Lo intentó pero no tuvo exito;He tried but he didn't succeed
Deseame suerte;Wish me luck
Dibújamelo.;Draw it for me.
Volaron sobre la ciudad.;They flew over the city.
No dije nada.;l didn't say anything.
Dile lo que dijiste.;Tell him what you said.
Di la verdad.;Tell the truth.
Cuéntanos un chiste.;Tell us a joke.
Cuenta hasta diez.;Count to ten.
Cuando me entere, la mataré.;When l find out, I'll kill her.
Me encantaría ayudarte.;l'd love to help you.
¿Me puedes echar una mano?;Can you give me a hand?
Creí que lo sabias.;I thought you knew.
No me grites.;Don't shout at me.
Si no lo haces, lo haré yo.;If you don't do it, I'll do it.
Hagámoslo una vez más.;Let's do it one more time.
¿Qué importa?;What difference does it make?
Creí que te gustaban las mujeres.;I thought you liked women.
Le empujaron al agua.;They pushed him into the water.
No le rompas la camisa.;Don't tear his shirt.
No me rompas la máquina.;Don't break my machine.
No tenemos alternativa.;We have no choice.
¿Cuándo nos va él a recoger?;When is he going to pick us up?
Espero que sepas lo que haces.;I hope you know what you're doing.
Deja de hablar tanto.;Stop talking so much.
¿Quién te dio permiso?;Who gave you permission?
Tú eres el que estoy buscando.;You're the one I'm looking for.
Todo fue culpa tuya.;Everything was your fault.
No sé de qué estás hablando.;I don't know what you're talking about.
No me mientas.;Don't lie to me.
Estoy cansado de escuchar tus quejas.;I'm tired of listening to your complaints.
Siempre te estás quejando.;You're always complaining.
Nos vamos a mudar a Noruega.;We're going to move to Norway.
Apúntalo.;Write it down.
Póntelo.;Put it on.
Quítatelo.;Take it off
Pruébatelo.;Try it on
Búscales.;Look for them.
Espérala.;Wait for her.
Mira eso.;Look at that.
Recógelos.;Pick them up.
Llévala a cenar.;Take her out to dinner.
No tienes que gritarles.;You don't have to shout at them.
Tiralo(a la basura);Throw it away.
Tiralo por la ventana.;Throw it out the window.
No te rindas.;Don't give up.
Lárgate.;Get out.
Lárgate de aquí;Get out of here.
Vuelve a llarmarle.;Call him back.
Sigue intentando.;Keep trying.
No te rías de mí.;Don't laugh at me.
Deja de llorar.;Stop crying.
¿De quién son esos dibujos?;Whose drawings are tose?
Probablemente intentarán matarles.;They'll probably try to kill them.
Es la mujer más hermosa del mundo.;She's the most beautiful woman in the world.
Todo el mundo hará el examen.;Everyone will take the exam.
Si apruebas el examen, aprobarás el curso.;If you pass the exam, you'll pass the course.
¿Cuántas asignaturas tengo que estudiar?;How many subjects do I have to study?
Hubo una explosión en aquella tienda.;There was an explosion in that shop.
¿Cuándo ocurrió?;When did it happen?
¿Había gente cerca?;Were there any people nearby?
Está sonando el teléfono.;The telephone's ringing.
¿Quién lo va a coger?;Who's going to answer it?
Nadie está interesado en tu dibujo.;Nobody's interested in your drawing.
¿Sabes cuánto tiempo tardé en dibujarlo?;Do you know how long it took me to draw it
Déjame que lo adivine.;Let me guess.
Bueno señores, ¿qué hacemos?;Well, gentlemen, what shall we do?
Es el mejor hombre que tenemos.;He's the best man we have.
Será difícil encontrar un sustituto.;It'll be difficult to find a replacement.
Nadie sabe tanto como él.;Nobody knows as much as he does.
Nadie habla tantos idiomas como él.;Nobody speaks as many languages as he does.
Nadie es tan persuasivo como él.;Nobody is as persuasive as he is.
Nadie tiene tantos contactos como él.;Nobody has as many contacts as he does.
Nadie es tan atractivo como él.;Nobody's as attractive as he is.
Tendremos que encontrar a alguien como él.;We'll have to find someone like him.
No va a ser fácil.;It's not going to be easy.
Es nuestra única alternativa.;It's our only alternative / choice.
Quisiéramos saber lo que él piensa.;We'd like to know what he thinks.
¿Por qué no le llamamos?;Why don't we call him?
Si crees que él nos ayudará, estás loco.;If you think he'll help us, you're crazy.
Vístete y vámonos.;Get dressed and let's go.
¿Me visto aquí o en el baño?;Shall l get dressed here or in the bathroom?
No me importa donde te vistas.;I don't care where you get dressed.
Él se está enfadando.;He's getting angry.
Me encuentro de maravilla.;I feel great.
¿Te importa llamar más tarde?;Do you mind calling back later?
Estaré aquí toda la tarde.;I'll be here all afternoon.
Si no estoy, deja un recado.;If I'm not here, leave a message.
Si nadie contesta, sigue llamando.;If no one answers, keep calling.
Siento tener que hacer esto.;I'm sorry to have to do this.
Fumo porque me gusta.;I smoke because I like to.
Él viene aquí porque le gusta.;He comes here because he likes to.
Se está ensuciando.;It's getting dirty.
¿Con qué frecuencia lo limpias?;How often do you clean it?
Tengo a una criada para limpiarlo.;I have a maid to clean it.
El llorar no ayudará.;Crying won't help.
Las cosas van bien.;Things are going well.
¿Qué tal estás?;How are you doing?
¿Cómo son los Americanos?;What are the Americans like?
Tienen ojos y orejas como nosotros.;They have eyes and ears like we do.
Sus antepasados eran europeos.;They're ancestors were European.
¿Tienen casas como las nuestras?;Do they have houses like ours?
¿Cual fue et veredicto?;What was the verdict
Le encontraron culpable.;They found him guilty.
¿Crees que lo hizo?;Do you think he did it?
No sé qué creer.;I don't know what to think.
Es como vivir en el campo.;It's like living in the country.
Este plan es nuestra salvación.;This plan is our salvation.
Ello sólo nos traerá problemas.;It'll only bring us problems.
Estoy en desacuerdo contigo.;I disagree with you.
¿En qué basas tu opinión?;What do you base your opinion on?
Son iguales(de parecido físico);They look exactly alike.
Deben de preocuparse mucho por ti.;They must worry a lot about you.
Lo oí pero no lo creo.;I heard it but l don't believe it.
No esperes demasiado.;Don't wait too long.
¿De qué trataba el artículo?;What was the article about?
De escándalos como siempre.;About scandals, as always.
¿No esta la gente interesada en otras cosas?;Aren't people interested in anything else?
Supongo que no.;I guess not / I suppose not.
¿Lees esos artículos?;Do you read those articles?
Trato de no leerlos.;I try not to read them.
Hace un día soleado.;It's a sunny day.
Luce el sol.;The sun is shining.
Se está nublando.;It's getting cloudy.
¿Qué tiempo hace?;What's the weather like?
Está empezando a llover.;It's starting to rain.
Hay niebla.;It's foggy.
La niebla está muy espesa.;The fog's very thick.
La nieve se está derritiendo.;The snow's melting.
¿Cuándo nos alcanzará la tormenta?;When will the storm reach us?
Está lloviendo a cántaros.;It's raining cats and dogs.
Está bajando el sol.;The sun's going down.
Pronto estará oscuro.;It'll be dark soon.
Los niños no salen cuando está oscuro.;Children don't go out when it's dark.
Hoy es el día más caluroso del año.;Today's the hottest day of the year.
Puedes freir un huevo en la acera.;You can fry an egg on the pavement.
No puedo dormir de noche.;I can't sleep at night.
No hay brisa.;There isn't any breeze.
Una leve brisa estaría bien.;A slight breeze would be nice.
A mi me gusta el calor.;I like the heat.
¿Quieres decir que te gusta este tiempo?;Do you mean you like this weather?
Me hace sentir fuerte.;It makes me feel strong.
Debes de estar loco.;You must be crazy.
Tuve que estar de pié en el autobús.;I had to stand up in the bus.
¿No te ofreció nadie un asiento?;Didn't anybody offer you a seat?
¿No se dieron cuenta de que estabas;Didn't they realise you were pregnant?
embarazada?;
Al parecer no.;Apparently not.
Fue un acontecimiento muy importante.;It was a very important event.
Yo no quería perderlo.;I didn't want to miss it.
No lo pude ver por la muchedumbre.;Icouldn't see it for the crowd.
Los árboles no te dejan ver el bosque.;You can't see the forest for the trees.
Llegaremos al fondo de este asunto.;e'll get to the bottom of this affair.
¿A qué hora sale el avión?;What time does the plane leave?
¿De qué puerta sale?;What gate does it leave from?
No podrás hacerlo.;You won't be able to do it.
Podremos verle mañana.;We'll be able to see him tomorrow.
¿Quién la despertó?;Who woke her up?
No fui yo.;lt wasn't me.
Entonces, ¿quién fue?;Then who was it?
¿Por qué me estás mirando a mí?;Why are you looking at me?
Quiero que hagas lo que te digo.;I want you to do what I tell you.
No quiero que te metas en líos.;I don't want you to get into trouble.
Quiero que todo el mundo sea feliz.;I want everyone to be happy.
